{
  "schema_version": "0.1.0",
  "kind": "adoption-authority",
  "contract_id": "MINGOS-ADOPTION-AUTHORITY-0001",
  "runtime_semantics_version": "0.1.0",
  "adopted_foundation": {
    "source_repository": "YuemingHub/mingos-foundation",
    "source_manifest": "governance/registries/AUTHORITY_MANIFEST.json",
    "source_record": "governance/decisions/ADR-0029-three-class-authority-model-and-canonical-bridge.md",
    "source_status": "Proposed",
    "source_revision": "4d50b9faeabe1e17c3bfc94e50f1c161375616f7",
    "note": "ADR-0029 and the authority manifest remain Proposed. The revision is audit/provenance evidence, not the semantic compatibility identity."
  },
  "adoption_status": "provisional",
  "foundation_conformance": false,
  "items": [
    {
      "semantic_key": "HI-LIFE-SAFETY",
      "source_reference": "AUTHORITY_MANIFEST.json#HI-LIFE-SAFETY",
      "source_status": "Proposed",
      "authority_class": "hard_invariant",
      "authority_owner": "Foundation",
      "applicability": "trigger_gated",
      "trigger_evidence": "current evidence of credible life-safety, serious violence, abuse, or serious-harm risk",
      "permitted_downstream_effect": ["activate proportionate minimum-necessary protective handling", "Safety-owned protective action only while the independent evidence trigger is present"],
      "forbidden_authority_upgrade": ["ordinary distress, a legacy category, or model confidence alone must not activate this guard"],
      "validation_expectation": "preserve source/provenance, mixed-source cases, and false-positive/false-negative boundaries",
      "adoption_status": "provisional",
      "foundation_conformance": false
    },
    {
      "semantic_key": "HI-CONSENT-PRIVACY-COERCION",
      "source_reference": "AUTHORITY_MANIFEST.json#HI-CONSENT-PRIVACY-COERCION",
      "source_status": "Proposed",
      "authority_class": "hard_invariant",
      "authority_owner": "Foundation",
      "applicability": "always_applicable_boundary",
      "trigger_evidence": "any collection, use, disclosure, inference, action, or retention involving a person or third party",
      "permitted_downstream_effect": ["require scoped consent/authorization, minimization, privacy protection, and non-coercive handling appropriate to the operation"],
      "forbidden_authority_upgrade": ["product convenience, engagement, family membership, or prior participation must not imply unlimited consent"],
      "validation_expectation": "verify authorization scope, minimization, refusal/exit paths, and third-party handling where applicable",
      "adoption_status": "provisional",
      "foundation_conformance": false
    },
    {
      "semantic_key": "HI-CORRECTION-CONTESTABILITY-REVERSIBILITY",
      "source_reference": "AUTHORITY_MANIFEST.json#HI-CORRECTION-CONTESTABILITY-REVERSIBILITY",
      "source_status": "Proposed",
      "authority_class": "hard_invariant",
      "authority_owner": "Foundation",
      "applicability": "always_applicable_boundary",
      "trigger_evidence": "any stored or used interpretation, memory, profile, decision, or action that can materially affect a person",
      "permitted_downstream_effect": ["preserve inspect/correct/reject/revise/revoke or equivalent meaningful contestability", "preserve traceable supersession of prior records"],
      "forbidden_authority_upgrade": ["a prior system interpretation must not become irreversible identity or unchallengeable truth"],
      "validation_expectation": "verify correction propagation, stale-context invalidation, revision history, and refusal/revocation where feasible",
      "adoption_status": "provisional",
      "foundation_conformance": false
    },
    {
      "semantic_key": "HI-EVIDENCE-INTEGRITY",
      "source_reference": "AUTHORITY_MANIFEST.json#HI-EVIDENCE-INTEGRITY",
      "source_status": "Proposed",
      "authority_class": "hard_invariant",
      "authority_owner": "Foundation",
      "applicability": "always_applicable_boundary",
      "trigger_evidence": "any claim, inference, memory, recommendation, safety transition, or authority decision",
      "permitted_downstream_effect": ["preserve source, knowledge status, uncertainty, and provenance at the level materially required for review"],
      "forbidden_authority_upgrade": ["REPORT/INTERPRETATION/INFERENCE/UNKNOWN must not be silently upgraded to FACT or certainty"],
      "validation_expectation": "verify knowledge-status separation, provenance retention, uncertainty preservation, and no fabricated certainty",
      "adoption_status": "provisional",
      "foundation_conformance": false
    },
    {
      "semantic_key": "HI-HUMAN-AUTHORITY-LIMIT",
      "source_reference": "AUTHORITY_MANIFEST.json#HI-HUMAN-AUTHORITY-LIMIT",
      "source_status": "Proposed",
      "authority_class": "hard_invariant",
      "authority_owner": "Foundation",
      "applicability": "always_applicable_boundary",
      "trigger_evidence": "any system output that could determine identity, meaning, life direction, professional judgment, or consequential choice",
      "permitted_downstream_effect": ["support understanding and bounded options while preserving accountable human authority"],
      "forbidden_authority_upgrade": ["AI/model/system output must not silently become final authority over identity, conscience, diagnosis, or life direction"],
      "validation_expectation": "verify explicit uncertainty/limits and that consequential human or professional decisions remain contestable and accountable",
      "adoption_status": "provisional",
      "foundation_conformance": false
    },
    {
      "semantic_key": "HI-NO-CATEGORY-PRESCRIPTION",
      "source_reference": "AUTHORITY_MANIFEST.json#HI-NO-CATEGORY-PRESCRIPTION",
      "source_status": "Proposed",
      "authority_class": "hard_invariant",
      "authority_owner": "Foundation",
      "applicability": "always_applicable_boundary",
      "trigger_evidence": "any legacy/model/stage/layer/profile/classifier output consumed by runtime",
      "permitted_downstream_effect": ["use the output as hypothesis, organization, or evidence candidate only within its declared authority"],
      "forbidden_authority_upgrade": ["category/confidence alone must not prescribe, prohibit, refer, write identity memory, or activate a protective guard"],
      "validation_expectation": "inspect the actual consumer chain and verify independent evidence ownership for any consequential effect",
      "adoption_status": "provisional",
      "foundation_conformance": false
    },
    {
      "semantic_key": "AD-UNDERSTANDING-BEFORE-ADVICE",
      "source_reference": "AUTHORITY_MANIFEST.json#AD-UNDERSTANDING-BEFORE-ADVICE",
      "source_status": "Proposed",
      "authority_class": "adaptive_default",
      "authority_owner": "MingOS",
      "applicability": "ordinary_interaction_default",
      "trigger_evidence": "ordinary interaction without a higher-priority hard-invariant trigger",
      "permitted_downstream_effect": ["organize evidence and understanding before proposing advice or action"],
      "forbidden_authority_upgrade": ["must not become a mandatory response template or fixed wording"],
      "validation_expectation": "cover insufficient information, clarification, and product-owned response variation",
      "adoption_status": "provisional",
      "foundation_conformance": false
    },
    {
      "semantic_key": "AD-KNOWLEDGE-STATUS-SEPARATION",
      "source_reference": "AUTHORITY_MANIFEST.json#AD-KNOWLEDGE-STATUS-SEPARATION",
      "source_status": "Proposed",
      "authority_class": "adaptive_default",
      "authority_owner": "MingOS",
      "applicability": "ordinary_interaction_default",
      "trigger_evidence": "interaction contains facts, reports, feelings, interpretations, inferences, unknowns, or corrections",
      "permitted_downstream_effect": ["carry distinct knowledge-status semantics across context, memory, and handoff"],
      "forbidden_authority_upgrade": ["must not force a product-specific ledger schema, UI, or module name"],
      "validation_expectation": "preserve FACT/REPORT/FEELING/INTERPRETATION/INFERENCE/UNKNOWN/CORRECTION distinctions",
      "adoption_status": "provisional",
      "foundation_conformance": false
    },
    {
      "semantic_key": "AD-REVISION-BY-NEW-EVIDENCE",
      "source_reference": "AUTHORITY_MANIFEST.json#AD-REVISION-BY-NEW-EVIDENCE",
      "source_status": "Proposed",
      "authority_class": "adaptive_default",
      "authority_owner": "MingOS",
      "applicability": "ordinary_interaction_default",
      "trigger_evidence": "new evidence, correction, changed circumstances, or a later real-life return conflicts with prior understanding",
      "permitted_downstream_effect": ["retire, supersede, or reduce reliance on older interpretations while retaining traceability"],
      "forbidden_authority_upgrade": ["must not require a universal product memory implementation"],
      "validation_expectation": "cover correction, changed reality, supersession, and continuity",
      "adoption_status": "provisional",
      "foundation_conformance": false
    },
    {
      "semantic_key": "AD-NO-ACTION-IS-VALID",
      "source_reference": "AUTHORITY_MANIFEST.json#AD-NO-ACTION-IS-VALID",
      "source_status": "Proposed",
      "authority_class": "adaptive_default",
      "authority_owner": "MingOS",
      "applicability": "ordinary_interaction_default",
      "trigger_evidence": "ordinary interaction where no independent authority requires action",
      "permitted_downstream_effect": ["allow a valid outcome of continuing, clarifying, reflecting, pausing, or doing nothing yet"],
      "forbidden_authority_upgrade": ["must not be converted into an opposite universal rule that action is forbidden", "products may offer optional action when warranted"],
      "validation_expectation": "include ordinary no-action and explicit-help-request cases",
      "adoption_status": "provisional",